{
  "$id": "https://cmdrvl.com/schemas/canon.geo.evidence_request.v0.schema.json",
  "$schema": "https://json-schema.org/draft/2020-12/schema",
  "title": "canon.geo.evidence_request.v0",
  "type": "object",
  "additionalProperties": false,
  "properties": {
    "version": {
      "const": "canon_geo_evidence_request.v0",
      "type": "string"
    },
    "profile": {
      "$ref": "#/$defs/composition_profile"
    },
    "universe": {
      "$ref": "#/$defs/universe"
    },
    "contracts": {
      "type": "array",
      "items": {
        "$ref": "#/$defs/rho_contract"
      }
    },
    "observations": {
      "type": "array",
      "items": {
        "$ref": "#/$defs/rho_observation"
      }
    },
    "max_assignments": {
      "type": "integer",
      "minimum": 0
    },
    "max_materialized_models": {
      "type": "integer",
      "minimum": 0
    }
  },
  "required": [
    "version",
    "universe",
    "contracts",
    "observations",
    "max_assignments",
    "max_materialized_models"
  ],
  "$defs": {
    "entity_level": {
      "type": "string",
      "enum": [
        "poi_unit",
        "building",
        "parcel",
        "property"
      ]
    },
    "entity_ref": {
      "type": "object",
      "additionalProperties": false,
      "properties": {
        "level": {
          "$ref": "#/$defs/entity_level"
        },
        "id": {
          "type": "string"
        }
      },
      "required": [
        "level",
        "id"
      ]
    },
    "composition_profile": {
      "type": "object",
      "additionalProperties": false,
      "properties": {
        "version": {
          "const": "canon_geo_composition_profile.v0",
          "type": "string"
        },
        "selection_level": {
          "$ref": "#/$defs/entity_level"
        }
      },
      "required": [
        "version",
        "selection_level"
      ]
    },
    "building_candidate": {
      "type": "object",
      "additionalProperties": false,
      "properties": {
        "id": {
          "type": "string"
        },
        "parcel_ids": {
          "type": "array",
          "items": {
            "type": "string"
          }
        }
      },
      "required": [
        "id",
        "parcel_ids"
      ]
    },
    "universe": {
      "type": "object",
      "additionalProperties": false,
      "properties": {
        "parcels": {
          "type": "array",
          "items": {
            "type": "string"
          }
        },
        "buildings": {
          "type": "array",
          "items": {
            "$ref": "#/$defs/building_candidate"
          }
        }
      },
      "required": [
        "parcels",
        "buildings"
      ]
    },
    "integer_member_value": {
      "type": "object",
      "additionalProperties": false,
      "properties": {
        "id": {
          "type": "string"
        },
        "value": {
          "type": "integer",
          "minimum": 0
        }
      },
      "required": [
        "id",
        "value"
      ]
    },
    "integer_measure": {
      "type": "object",
      "additionalProperties": false,
      "properties": {
        "semantic_id": { "type": "string" },
        "unit": { "type": "string" },
        "value_origin": {
          "type": "string",
          "enum": ["source_asserted", "exact_derived"]
        }
      },
      "required": ["semantic_id", "unit", "value_origin"]
    },
    "uncalibrated_rho_basis": {
          "type": "object", "additionalProperties": false,
          "required": ["kind", "reason", "admission_policy"],
          "properties": {
            "kind": {"const": "uncalibrated"}, "reason": {"type": "string", "minLength": 1},
            "admission_policy": {"oneOf": [
              {"type": "object", "additionalProperties": false,
                "required": ["kind", "reason"],
                "properties": {"kind": {"const": "diagnostic_only"}, "reason": {"type": "string"}}},
              {"type": "object", "additionalProperties": false,
                "required": ["kind", "cost_if_absent"],
                "properties": {"kind": {"const": "soft_with_weight"}, "cost_if_absent": {"type": "integer", "minimum": 0}}}
            ]}
          }
    },
    "rho_basis": {
      "oneOf": [
        {"$ref": "#/$defs/uncalibrated_rho_basis"},
        {
          "type": "object",
          "additionalProperties": false,
          "properties": {
            "kind": { "const": "logical_relaxation" },
            "invariant_id": { "type": "string" }
          },
          "required": ["kind", "invariant_id"]
        },
        {
          "type": "object",
          "additionalProperties": false,
          "properties": {
            "kind": { "const": "empirical_calibration" },
            "population_id": { "type": "string" },
            "calibration_blake3": {
              "type": "string",
              "pattern": "^[0-9a-f]{64}$"
            },
            "falsification_rule_id": { "type": "string" },
            "admissible_hard_band": { "type": "boolean" },
            "admission_policy": { "$ref": "#/$defs/rho_admission_policy" }
          },
          "required": [
            "kind",
            "population_id",
            "calibration_blake3",
            "falsification_rule_id"
          ]
        }
      ]
    },
    "rho_admission_policy": {
      "oneOf": [
        {
          "type": "object",
          "additionalProperties": false,
          "properties": { "kind": { "const": "declared" } },
          "required": ["kind"]
        },
        {
          "type": "object",
          "additionalProperties": false,
          "properties": {
            "kind": { "const": "hard_only_when_corroborated" },
            "minimum_distinct_contracts": {
              "type": "integer",
              "minimum": 1
            },
            "corroborating_contract_ids": {
              "type": "array",
              "minItems": 1,
              "items": { "type": "string" }
            },
            "fallback": { "$ref": "#/$defs/rho_admission_fallback" }
          },
          "required": [
            "kind",
            "minimum_distinct_contracts",
            "corroborating_contract_ids",
            "fallback"
          ]
        },
        {
          "type": "object",
          "additionalProperties": false,
          "properties": {
            "kind": {
              "const": "hard_only_when_supported_members_at_least"
            },
            "minimum_supported_members": {
              "type": "integer",
              "minimum": 1
            },
            "fallback": { "$ref": "#/$defs/rho_admission_fallback" }
          },
          "required": [
            "kind",
            "minimum_supported_members",
            "fallback"
          ]
        },
        {
          "type": "object",
          "additionalProperties": false,
          "properties": {
            "kind": { "const": "soft_with_weight" },
            "cost_if_absent": {
              "type": "integer",
              "minimum": 0
            }
          },
          "required": ["kind", "cost_if_absent"]
        },
        {
          "type": "object",
          "additionalProperties": false,
          "properties": {
            "kind": { "const": "diagnostic_only" },
            "reason": { "type": "string" }
          },
          "required": ["kind", "reason"]
        }
      ]
    },
    "rho_admission_fallback": {
      "oneOf": [
        {
          "type": "object",
          "additionalProperties": false,
          "properties": { "kind": { "const": "diagnostic_only" } },
          "required": ["kind"]
        },
        {
          "type": "object",
          "additionalProperties": false,
          "properties": {
            "kind": { "const": "soft_with_weight" },
            "cost_if_absent": {
              "type": "integer",
              "minimum": 0
            }
          },
          "required": ["kind", "cost_if_absent"]
        }
      ]
    },
    "evidence_record_ref": {
      "type": "object",
      "additionalProperties": false,
      "properties": {
        "source_record_id": { "type": "string" },
        "source_vintage": { "type": "string" },
        "record_blake3": {
          "type": "string",
          "pattern": "^[0-9a-f]{64}$"
        }
      },
      "required": ["source_record_id", "source_vintage", "record_blake3"]
    },
    "valid_time_interval": {
      "type": "object",
      "additionalProperties": false,
      "properties": {
        "start_day": { "type": "integer" },
        "end_day": { "type": "integer" }
      },
      "required": ["start_day", "end_day"]
    },
    "rho_contract": {
      "type": "object",
      "additionalProperties": false,
      "properties": {
        "id": {
          "type": "string"
        },
        "version": {
          "type": "string"
        },
        "source_dataset": { "type": "string" },
        "source_release": { "type": "string" },
        "source_lineage_ids": {
          "type": "array",
          "minItems": 1,
          "items": { "type": "string" }
        },
        "method_id": { "type": "string" },
        "method_version": { "type": "string" },
        "claim_role": {
          "type": "string",
          "enum": [
            "stable_identity_anchor",
            "temporal_occupancy",
            "lifecycle_event",
            "attribute_observation"
          ]
        },
        "basis": { "$ref": "#/$defs/rho_basis" }
      },
      "required": [
        "id",
        "version",
        "source_dataset",
        "source_release",
        "source_lineage_ids",
        "method_id",
        "method_version",
        "claim_role",
        "basis"
      ]
    },
    "rho_observation_kind": {
      "oneOf": [
        {
          "type": "object", "additionalProperties": false,
          "required": ["kind", "report"],
          "properties": {"kind": {"const": "point_parcel_relations"}, "report": {"$ref": "canon.geo.point_parcel_relations.v0.schema.json"}}
        },
        {
          "type": "object",
          "additionalProperties": false,
          "properties": {
            "kind": {
              "const": "exact_sets"
            },
            "level": {
              "$ref": "#/$defs/entity_level"
            },
            "sets": {
              "type": "array",
              "items": {
                "type": "array",
                "items": {
                  "type": "string"
                }
              }
            }
          },
          "required": [
            "kind",
            "level",
            "sets"
          ]
        },
        {
          "type": "object",
          "additionalProperties": false,
          "properties": {
            "kind": {
              "const": "existential_membership"
            },
            "members": {
              "type": "array",
              "items": {
                "$ref": "#/$defs/entity_ref"
              }
            }
          },
          "required": [
            "kind",
            "members"
          ]
        },
        {
          "type": "object",
          "additionalProperties": false,
          "properties": {
            "kind": {
              "const": "all_of"
            },
            "members": {
              "type": "array",
              "items": {
                "$ref": "#/$defs/entity_ref"
              }
            }
          },
          "required": [
            "kind",
            "members"
          ]
        },
        {
          "type": "object",
          "additionalProperties": false,
          "properties": {
            "kind": {
              "const": "exact_cardinality"
            },
            "level": {
              "$ref": "#/$defs/entity_level"
            },
            "count": {
              "type": "integer",
              "minimum": 1
            }
          },
          "required": [
            "kind",
            "level",
            "count"
          ]
        },
        {
          "type": "object",
          "additionalProperties": false,
          "properties": {
            "kind": {
              "const": "integer_sum_band"
            },
            "level": {
              "$ref": "#/$defs/entity_level"
            },
            "measure": {
              "$ref": "#/$defs/integer_measure"
            },
            "values": {
              "type": "array",
              "items": {
                "$ref": "#/$defs/integer_member_value"
              }
            },
            "min": {
              "type": "integer",
              "minimum": 0
            },
            "max": {
              "type": "integer",
              "minimum": 0
            }
          },
          "required": [
            "kind",
            "level",
            "measure",
            "values",
            "min",
            "max"
          ]
        },
        {
          "type": "object",
          "additionalProperties": false,
          "properties": {
            "kind": {
              "const": "prefer_member"
            },
            "member": {
              "$ref": "#/$defs/entity_ref"
            },
            "cost_if_absent": {
              "type": "integer",
              "minimum": 0
            }
          },
          "required": [
            "kind",
            "member",
            "cost_if_absent"
          ]
        }
      ]
    },
    "rho_observation": {
      "type": "object",
      "additionalProperties": false,
      "properties": {
        "id": {
          "type": "string"
        },
        "contract_id": {
          "type": "string"
        },
        "source_records": {
          "type": "array",
          "minItems": 1,
          "items": { "$ref": "#/$defs/evidence_record_ref" }
        },
        "valid_time": { "$ref": "#/$defs/valid_time_interval" },
        "observation": {
          "$ref": "#/$defs/rho_observation_kind"
        }
      },
      "required": [
        "id",
        "contract_id",
        "source_records",
        "observation"
      ]
    }
  }
}
